{"schemaVersion":1,"pageId":"switchboard-directory","siteId":"switchboard","path":"/directory.html","title":"Switchboard Directory Search","layout":"plain","theme":{"background":"#ffffff","text":"#000000","link":"#0000ee","visitedLink":"#551a8b","font":"serif"},"meta":{"lastModified":"1995-12-08","author":"The Switchboard Team"},"blocks":[{"type":"heading","level":1,"text":"Directory Search"},{"type":"paragraph","content":[{"type":"text","text":"Type a word or two, such as "},{"type":"text","text":"coffee","marks":["bold"]},{"type":"text","text":" or "},{"type":"text","text":"stars","marks":["bold"]},{"type":"text","text":", and press Search."}]},{"type":"widget","widget":{"name":"directory-search","props":{"scope":"all-sites"}},"id":"search"},{"type":"heading","level":2,"text":"Browse by category"},{"type":"table","border":1,"header":[{"content":[{"type":"text","text":"Category"}]},{"content":[{"type":"text","text":"Sites"}]}],"rows":[[{"content":[{"type":"text","text":"Food & Drink"}]},{"content":[{"type":"link","href":"http://chugging.test/","text":"Chugging Coffee House"}]}],[{"content":[{"type":"text","text":"News"}]},{"content":[{"type":"link","href":"http://packet.test/","text":"The Daily Packet"}]}],[{"content":[{"type":"text","text":"Education"}]},{"content":[{"type":"link","href":"http://northstar.test/","text":"Northstar Campus"}]}],[{"content":[{"type":"text","text":"Computers"}]},{"content":[{"type":"link","href":"http://bytemarket.test/","text":"Byte Market"},{"type":"break"},{"type":"link","href":"http://nightowl.test/","text":"Night Owl Bulletin"}]}],[{"content":[{"type":"text","text":"Personal Pages"}]},{"content":[{"type":"link","href":"http://lantern.test/","text":"Lantern Point"},{"type":"break"},{"type":"link","href":"http://northstar.test/~mira/","text":"Mira's page"}]}]],"caption":"Listings by category"},{"type":"paragraph","content":[{"type":"link","href":"/","text":"Back to Switchboard"}]}]}