{
  "schemaVersion": 1,
  "pageId": "chugging-home",
  "siteId": "chugging",
  "path": "/",
  "title": "Chugging Coffee House",
  "layout": "centered",
  "theme": {
    "background": "#fff8e7",
    "text": "#3b2412",
    "link": "#8b0000",
    "visitedLink": "#5a3a22",
    "font": "serif"
  },
  "meta": {
    "lastModified": "1995-12-08",
    "author": "Dot"
  },
  "blocks": [
    {
      "type": "heading",
      "id": "title",
      "level": 1,
      "text": "Chugging Coffee House",
      "align": "center"
    },
    {
      "type": "image",
      "id": "mug",
      "assetId": "site.chugging.mug",
      "alt": "A steaming mug of coffee",
      "width": 120,
      "height": 100,
      "declaredBytes": 6144,
      "align": "center"
    },
    {
      "type": "paragraph",
      "id": "intro",
      "align": "center",
      "content": [
        {
          "type": "text",
          "text": "Open till midnight, seven days a week. "
        },
        {
          "type": "text",
          "text": "Free refills",
          "marks": [
            "bold"
          ]
        },
        {
          "type": "text",
          "text": " and a warm corner booth for night owls."
        }
      ]
    },
    {
      "type": "rule"
    },
    {
      "type": "list",
      "ordered": false,
      "items": [
        [
          {
            "type": "link",
            "href": "/menu.html",
            "text": "Our menu"
          },
          {
            "type": "text",
            "text": " (prices good through December)"
          }
        ],
        [
          {
            "type": "link",
            "href": "/notices.html",
            "text": "The notice board"
          },
          {
            "type": "text",
            "text": " (lost & found, rides, the poetry night)"
          }
        ],
        [
          {
            "type": "link",
            "href": "http://packet.test/coffee-online.html",
            "text": "We made the paper!"
          }
        ],
        [
          {
            "type": "link",
            "href": "http://switchboard.test/",
            "text": "Find more on Switchboard"
          }
        ]
      ]
    },
    {
      "type": "heading",
      "level": 3,
      "text": "How much coffee should I brew?"
    },
    {
      "type": "widget",
      "id": "brew",
      "widget": {
        "name": "brew-calculator",
        "props": {
          "defaultCups": 4,
          "gramsPerCup": 10
        }
      }
    },
    {
      "type": "rule"
    },
    {
      "type": "widget",
      "id": "counter",
      "widget": {
        "name": "hit-counter",
        "props": {
          "count": 1995,
          "digits": 6
        }
      }
    }
  ]
}
