{
  "schemaVersion": 1,
  "pageId": "bytemarket-classifieds",
  "siteId": "bytemarket",
  "path": "/classifieds.html",
  "title": "Byte Market Classifieds",
  "layout": "plain",
  "theme": {
    "background": "#ffffff",
    "text": "#000000",
    "link": "#000080",
    "visitedLink": "#800080",
    "font": "serif"
  },
  "meta": {
    "lastModified": "1995-12-07",
    "author": "Sam Okafor"
  },
  "blocks": [
    {
      "type": "heading",
      "level": 1,
      "text": "Classified Ads"
    },
    {
      "type": "paragraph",
      "content": [
        {
          "type": "text",
          "text": "Free for customers. Ads run for two weeks. We do not handle money or deliveries; contact the seller."
        }
      ]
    },
    {
      "type": "rule"
    },
    {
      "type": "paragraph",
      "content": [
        {
          "type": "text",
          "text": "FOR SALE:",
          "marks": [
            "bold"
          ]
        },
        {
          "type": "text",
          "text": " Amiga 500, 1 MB, lots of games. Best offer. Ask at the counter."
        }
      ]
    },
    {
      "type": "paragraph",
      "content": [
        {
          "type": "text",
          "text": "WANTED:",
          "marks": [
            "bold"
          ]
        },
        {
          "type": "text",
          "text": " SoundBlaster 16 for a homework computer. Ask for Ana."
        }
      ]
    },
    {
      "type": "paragraph",
      "content": [
        {
          "type": "text",
          "text": "FOR SALE:",
          "marks": [
            "bold"
          ]
        },
        {
          "type": "text",
          "text": " brass ship lantern, very old, still has its lens. Not a computer, sorry Sam. It came from the lighthouse at the point. Ask for W. at the coffee house."
        }
      ],
      "id": "clue-brass"
    },
    {
      "type": "paragraph",
      "content": [
        {
          "type": "text",
          "text": "FOR TRADE:",
          "marks": [
            "bold"
          ]
        },
        {
          "type": "text",
          "text": " Star Trek novels for a 3.5\" floppy drive."
        }
      ]
    },
    {
      "type": "rule"
    },
    {
      "type": "paragraph",
      "content": [
        {
          "type": "link",
          "href": "/",
          "text": "Back to the catalog"
        },
        {
          "type": "text",
          "text": " | "
        },
        {
          "type": "link",
          "href": "http://chugging.test/notices.html",
          "text": "More notices at Chugging"
        }
      ]
    }
  ]
}
