{
  "schemaVersion": 1,
  "pageId": "bytemarket-modem-calc",
  "siteId": "bytemarket",
  "path": "/modem-calc.html",
  "title": "How Long Will It Take?",
  "layout": "centered",
  "theme": {
    "background": "#c0c0c0",
    "text": "#000000",
    "link": "#000080",
    "visitedLink": "#800080",
    "font": "sans"
  },
  "meta": {
    "lastModified": "1995-12-07",
    "author": "Sam Okafor"
  },
  "blocks": [
    {
      "type": "heading",
      "level": 1,
      "text": "How long will it take?",
      "align": "center"
    },
    {
      "type": "paragraph",
      "content": [
        {
          "type": "text",
          "text": "Type the size of a file in kilobytes to see how long it takes to download at each speed. Times assume a clean line."
        }
      ],
      "align": "center"
    },
    {
      "type": "widget",
      "widget": {
        "name": "download-time-calculator",
        "props": {
          "speedsBps": [
            2400,
            9600,
            14400,
            28800
          ]
        }
      },
      "id": "calc"
    },
    {
      "type": "paragraph",
      "content": [
        {
          "type": "text",
          "text": "Still on 2400? Upgrade to a "
        },
        {
          "type": "link",
          "href": "/",
          "text": "28.8 modem"
        },
        {
          "type": "text",
          "text": " this week. The library is getting modems too: "
        },
        {
          "type": "link",
          "href": "http://packet.test/library-modems.html",
          "text": "read the story"
        },
        {
          "type": "text",
          "text": "."
        }
      ],
      "align": "center"
    }
  ]
}
