{
  "schemaVersion": 1,
  "pageId": "chugging-menu",
  "siteId": "chugging",
  "path": "/menu.html",
  "title": "Chugging Coffee House - Menu",
  "layout": "plain",
  "theme": { "background": "#fff8e7", "text": "#3b2412", "link": "#8b0000", "visitedLink": "#5a3a22", "font": "serif" },
  "meta": { "lastModified": "1995-12-01", "author": "Dot" },
  "blocks": [
    { "type": "heading", "level": 1, "text": "Menu" },
    { "type": "table", "id": "drinks", "caption": "Drinks", "border": 1, "header": [{ "content": [{ "type": "text", "text": "Drink" }] }, { "content": [{ "type": "text", "text": "Price" }], "align": "right" }],
      "rows": [
        [{ "content": [{ "type": "text", "text": "House drip" }] }, { "content": [{ "type": "text", "text": "$0.95" }], "align": "right" }],
        [{ "content": [{ "type": "text", "text": "Espresso" }] }, { "content": [{ "type": "text", "text": "$1.25" }], "align": "right" }],
        [{ "content": [{ "type": "text", "text": "Cafe au lait" }] }, { "content": [{ "type": "text", "text": "$1.75" }], "align": "right" }],
        [{ "content": [{ "type": "text", "text": "Hot cocoa" }] }, { "content": [{ "type": "text", "text": "$1.50" }], "align": "right" }]
      ] },
    { "type": "table", "id": "food", "caption": "Something to eat", "border": 1,
      "rows": [
        [{ "content": [{ "type": "text", "text": "Slice of pie (ask about today's)" }] }, { "content": [{ "type": "text", "text": "$2.25" }], "align": "right" }],
        [{ "content": [{ "type": "text", "text": "Bagel with cream cheese" }] }, { "content": [{ "type": "text", "text": "$1.50" }], "align": "right" }]
      ] },
    { "type": "paragraph", "content": [{ "type": "text", "text": "Prices include tax. We do not take credit cards yet - sorry!", "marks": ["italic"] }] },
    { "type": "link", "href": "/", "text": "Back to the front door" }
  ]
}
