{"schemaVersion":1,"pageId":"lantern-home","siteId":"lantern","path":"/","title":"Lantern Point","layout":"homepage","theme":{"background":"#e8eef4","text":"#1d2a3a","link":"#a33a1a","visitedLink":"#6a4a7a","font":"serif"},"meta":{"lastModified":"1995-12-08","author":"Wren Holloway"},"blocks":[{"type":"heading","level":1,"text":"Lantern Point","align":"center"},{"type":"image","assetId":"site.lantern.lighthouse","alt":"The Lantern Point lighthouse at dusk","width":160,"height":120,"declaredBytes":9216,"align":"center","href":"/gallery.html"},{"type":"paragraph","content":[{"type":"text","text":"Hello and welcome. I'm Wren. My grandfather kept the light at Lantern Point until it was shut down in 1971. This page is for him, and for anyone who loves lighthouses."}]},{"type":"list","ordered":false,"items":[[{"type":"link","href":"/gallery.html","text":"Photo gallery"}],[{"type":"link","href":"/logbook.html","text":"Grandpa's logbook"},{"type":"text","text":" - help me finish it!"}]]},{"type":"paragraph","content":[{"type":"text","text":"Friends of the point: the "},{"type":"link","href":"http://nightowl.test/","text":"Night Owl Bulletin"},{"type":"text","text":" crowd, the stargazers at "},{"type":"link","href":"http://northstar.test/club/","text":"Northstar"},{"type":"text","text":", and everyone at "},{"type":"link","href":"http://chugging.test/","text":"Chugging"},{"type":"text","text":"."}]},{"type":"heading","level":2,"text":"Guestbook"},{"type":"widget","widget":{"name":"guestbook-archive","props":{"entries":[{"name":"Mira C.","storyDate":"1995-12-06","message":"We saw the light from the dome! Three, two, three."},{"name":"Gus (sysop)","storyDate":"1995-12-04","message":"Nice page. Come say hi on the BBS."},{"name":"Dot","storyDate":"1995-12-02","message":"Your usual booth is waiting, hon."}]}},"id":"guestbook"}]}