{"schemaVersion":1,"pageId":"northstar-astro","siteId":"northstar","path":"/astro/","title":"Department of Physics & Astronomy","layout":"academic","theme":{"background":"#ffffff","text":"#000000","link":"#13265c","visitedLink":"#6b4c9a","font":"serif"},"meta":{"lastModified":"1995-12-04","author":"Prof. Elena Park"},"blocks":[{"type":"heading","level":1,"text":"Department of Physics & Astronomy"},{"type":"paragraph","content":[{"type":"text","text":"Hale Hall, second floor. The department offers degrees in physics and an astronomy minor. Our 14-inch telescope sits in the dome on the roof."}]},{"type":"heading","level":2,"text":"Faculty"},{"type":"table","border":1,"header":[{"content":[{"type":"text","text":"Name"}]},{"content":[{"type":"text","text":"Interests"}]},{"content":[{"type":"text","text":"Office"}]}],"rows":[[{"content":[{"type":"text","text":"Prof. Elena Park"}]},{"content":[{"type":"text","text":"Variable stars"}]},{"content":[{"type":"text","text":"Hale 214"}]}],[{"content":[{"type":"text","text":"Prof. Tomas Webb"}]},{"content":[{"type":"text","text":"Optics"}]},{"content":[{"type":"text","text":"Hale 220"}]}],[{"content":[{"type":"text","text":"Dr. Ruth Iyer"}]},{"content":[{"type":"text","text":"Planetary science"}]},{"content":[{"type":"text","text":"Hale 207"}]}]],"caption":"Faculty, fall 1995"},{"type":"heading","level":2,"text":"Public nights"},{"type":"paragraph","content":[{"type":"text","text":"The dome is open to the public on clear Friday evenings. See the "},{"type":"link","href":"/club/","text":"Astronomy Club"},{"type":"text","text":" page for the observing log."}]},{"type":"paragraph","content":[{"type":"link","href":"/","text":"Northstar home"},{"type":"text","text":" | "},{"type":"link","href":"http://switchboard.test/","text":"Switchboard"}]}]}