{"schemaVersion":1,"pageId":"northstar-club","siteId":"northstar","path":"/club/","title":"Northstar Astronomy Club","layout":"plain","theme":{"background":"#000033","text":"#e0e0ff","link":"#ffcc33","visitedLink":"#cc99ff","font":"sans"},"meta":{"lastModified":"1995-12-06","author":"Mira Chen, club secretary"},"blocks":[{"type":"heading","level":1,"text":"Northstar Astronomy Club"},{"type":"paragraph","content":[{"type":"text","text":"We meet on the roof of Hale Hall on clear nights. Everyone is welcome, even if you have never looked through a telescope."}]},{"type":"heading","level":2,"text":"Observing log"},{"type":"preformatted","text":"DATE      SKY     NOTES\n--------  ------  ------------------------------------\n11/24/95  clear   Saturn low in the SW. Pleiades great.\n11/28/95  hazy    Moon only. Gave up at 10.\n12/02/95  clear   Orion rising. Andromeda galaxy found\n                  by three new members!","label":"Observing log, a table of dates, sky conditions and notes"},{"type":"paragraph","content":[{"type":"text","text":"12/05/95, 11:40 pm:","marks":["bold"]},{"type":"text","text":" while packing up we saw a light flashing from out at Lantern Point: three flashes, a pause, two, a pause, three. Over and over. The old lighthouse has been dark for years. Mira thinks someone is signalling."}],"id":"clue-flash"},{"type":"paragraph","content":[{"type":"text","text":"More about the point on "},{"type":"link","href":"http://lantern.test/","text":"Wren Holloway's page"},{"type":"text","text":". Our department is "},{"type":"link","href":"/astro/","text":"Physics & Astronomy"},{"type":"text","text":"."}]}]}