{"schemaVersion":1,"pageId":"packet-coffee-online","siteId":"packet","path":"/coffee-online.html","title":"Coffee house puts its menu on the Web - The Daily Packet","layout":"newspaper","theme":{"background":"#ffffff","text":"#000000","link":"#000080","visitedLink":"#800080","font":"serif"},"meta":{"lastModified":"1995-12-01","author":"Staff writer"},"blocks":[{"type":"heading","level":1,"text":"Coffee house puts its menu on the World Wide Web"},{"type":"paragraph","content":[{"type":"text","text":"By our staff writer","marks":["italic"]}]},{"type":"paragraph","content":[{"type":"text","text":"The Chugging Coffee House on Elm Street has joined a small but growing list of local businesses with a page on the World Wide Web. Owner Dot says the idea came from a regular who kept bringing a laptop to the corner booth."}]},{"type":"paragraph","content":[{"type":"text","text":"\"People ask me what a home page is,\" she said. \"I tell them it's like our sign out front, except you can read the menu from your living room.\""}]},{"type":"paragraph","content":[{"type":"text","text":"Readers with a modem can visit the page at "},{"type":"link","href":"http://chugging.test/","text":"chugging.test"},{"type":"text","text":", or find it through the Switchboard directory."}]},{"type":"link","href":"/","text":"Back to today's headlines"}]}