{"schemaVersion":1,"pageId":"bytemarket-home","siteId":"bytemarket","path":"/","title":"Byte Market - Computers & Parts","layout":"catalog","theme":{"background":"#c0c0c0","text":"#000000","link":"#000080","visitedLink":"#800080","font":"sans"},"meta":{"lastModified":"1995-12-07","author":"Sam Okafor"},"blocks":[{"type":"image","assetId":"site.bytemarket.logo","alt":"Byte Market","width":320,"height":56,"declaredBytes":4608,"align":"center"},{"type":"paragraph","content":[{"type":"text","text":"Third Street, next to the coffee house. Open 10 to 7, closed Sundays.","marks":["bold"]}],"align":"center"},{"type":"heading","level":2,"text":"This week in the store"},{"type":"table","border":1,"header":[{"content":[{"type":"text","text":"Item"}]},{"content":[{"type":"text","text":"Description"}]},{"content":[{"type":"text","text":"Price"}]}],"rows":[[{"content":[{"type":"text","text":"28.8 modem"}]},{"content":[{"type":"text","text":"External, V.34, with cable and software"}]},{"content":[{"type":"text","text":"$189"}],"align":"right"}],[{"content":[{"type":"text","text":"14.4 modem"}]},{"content":[{"type":"text","text":"Internal, ISA"}]},{"content":[{"type":"text","text":"$79"}],"align":"right"}],[{"content":[{"type":"text","text":"Pentium 75"}]},{"content":[{"type":"text","text":"8 MB RAM, 850 MB disk, CD-ROM, 15\" monitor"}]},{"content":[{"type":"text","text":"$1,899"}],"align":"right"}],[{"content":[{"type":"text","text":"Windows 95"}]},{"content":[{"type":"text","text":"Upgrade, 3.5\" disks or CD-ROM"}]},{"content":[{"type":"text","text":"$89"}],"align":"right"}],[{"content":[{"type":"text","text":"Mouse pad"}]},{"content":[{"type":"text","text":"Fish or stars design"}]},{"content":[{"type":"text","text":"$4"}],"align":"right"}]],"caption":"Prices good through December 15"},{"type":"paragraph","content":[{"type":"text","text":"Catalog only: this is a picture of our shelves. Please visit or call the store to buy.","marks":["italic"]}]},{"type":"list","ordered":false,"items":[[{"type":"link","href":"/classifieds.html","text":"Classified ads"},{"type":"text","text":" - buy and sell used equipment"}],[{"type":"link","href":"/modem-calc.html","text":"How long will it take?"},{"type":"text","text":" - our download-time calculator"}]]},{"type":"paragraph","content":[{"type":"text","text":"Need a break? "},{"type":"link","href":"http://chugging.test/","text":"Coffee next door"},{"type":"text","text":". Need help? Ask on the "},{"type":"link","href":"http://nightowl.test/","text":"Night Owl Bulletin"},{"type":"text","text":"."}]}]}