{"schemaVersion":1,"pageId":"switchboard-whats-new","siteId":"switchboard","path":"/whats-new.html","title":"What's New on Switchboard","layout":"plain","theme":{"background":"#ffffcc","text":"#000000","link":"#0000ee","visitedLink":"#551a8b","font":"serif"},"meta":{"lastModified":"1995-12-08","author":"The Switchboard Team"},"blocks":[{"type":"heading","level":1,"text":"What's New on Switchboard"},{"type":"paragraph","content":[{"type":"text","text":"New listings this week, newest first."}]},{"type":"heading","level":3,"text":"December 8, 1995"},{"type":"list","ordered":false,"items":[[{"type":"link","href":"http://lantern.test/","text":"Lantern Point"},{"type":"text","text":" - a lighthouse keeper's granddaughter puts the family logbook online. Something is missing from it."}],[{"type":"link","href":"http://nightowl.test/","text":"Night Owl Bulletin"},{"type":"text","text":" - the BBS everyone dials after midnight opens a Web page."}],[{"type":"link","href":"http://bytemarket.test/","text":"Byte Market"},{"type":"text","text":" - the computer shop on Third Street. Prices on 28.8 modems!"}]]},{"type":"heading","level":3,"text":"December 1, 1995"},{"type":"list","ordered":false,"items":[[{"type":"link","href":"http://northstar.test/","text":"Northstar Campus"},{"type":"text","text":" - the college is online, astronomy club and all."}],[{"type":"link","href":"http://chugging.test/","text":"Chugging Coffee House"},{"type":"text","text":" - the menu is on the Web."}]]},{"type":"heading","level":3,"text":"November 30, 1995"},{"type":"paragraph","content":[{"type":"text","text":"Switchboard passes 1,000 listings. Thank you for all your suggestions!"}],"id":"thousand"},{"type":"rule"},{"type":"paragraph","content":[{"type":"link","href":"/","text":"Back to Switchboard"}]}]}